{
  "schemaVersion": "1.0.0",
  "name": "compass-components",
  "description": "Product-aware, reusable interface patterns for humans and AI coding agents.",
  "categories": ["navigation", "actions", "data", "feedback", "overlay", "forms", "ai"],
  "components": [
    { "id": "sidebar", "name": "Sidebar", "category": "navigation", "status": "stable", "description": "Persistent navigation for application sections when orientation and frequent destination changes justify a dedicated region.", "version": "1.0.0", "implementation": "html-css-js-reference", "dependencies": [], "files": ["components/sidebar/README.md", "components/sidebar/component.json", "components/sidebar/reference/example.html", "components/sidebar/reference/component.css", "components/sidebar/reference/component.js"] },
    { "id": "tabs", "name": "Tabs", "category": "navigation", "status": "planned", "description": "Switches between closely related peer panels without changing the surrounding task context.", "version": "0.1.0", "implementation": "none", "dependencies": [], "files": [] },
    { "id": "breadcrumb", "name": "Breadcrumb", "category": "navigation", "status": "planned", "description": "Shows location in a meaningful hierarchical path and offers navigation to ancestors.", "version": "0.1.0", "implementation": "none", "dependencies": [], "files": [] },
    { "id": "command-menu", "name": "Command Menu", "category": "navigation", "status": "planned", "description": "Searches available actions for users who benefit from a fast keyboard-oriented command path.", "version": "0.1.0", "implementation": "none", "dependencies": [], "files": [] },
    { "id": "button", "name": "Button", "category": "actions", "status": "stable", "description": "Invokes an action in the current context with clear priority and native keyboard behavior.", "version": "1.0.0", "implementation": "html-css-reference", "dependencies": [], "files": ["components/button/README.md", "components/button/component.json", "components/button/reference/example.html", "components/button/reference/component.css"] },
    { "id": "dropdown-menu", "name": "Dropdown Menu", "category": "actions", "status": "planned", "description": "Reveals a small set of related actions when keeping them continuously visible would add noise.", "version": "0.1.0", "implementation": "none", "dependencies": [], "files": [] },
    { "id": "data-table", "name": "Data Table", "category": "data", "status": "stable", "description": "Supports comparison and repeated work across records with shared fields.", "version": "1.0.0", "implementation": "html-css-js-reference", "dependencies": [], "files": ["components/data-table/README.md", "components/data-table/component.json", "components/data-table/reference/example.html", "components/data-table/reference/component.css", "components/data-table/reference/component.js"] },
    { "id": "filters", "name": "Filters", "category": "data", "status": "planned", "description": "Narrows a result set with visible, understandable constraints and recovery.", "version": "0.1.0", "implementation": "none", "dependencies": [], "files": [] },
    { "id": "pagination", "name": "Pagination", "category": "data", "status": "planned", "description": "Moves through a bounded result set while preserving location and query context.", "version": "0.1.0", "implementation": "none", "dependencies": [], "files": [] },
    { "id": "empty-state", "name": "Empty State", "category": "feedback", "status": "stable", "description": "Explains why a region has no content and offers a truthful, useful next step.", "version": "1.0.0", "implementation": "html-css-reference", "dependencies": [], "files": ["components/empty-state/README.md", "components/empty-state/component.json", "components/empty-state/reference/example.html", "components/empty-state/reference/component.css"] },
    { "id": "alert", "name": "Alert", "category": "feedback", "status": "planned", "description": "Presents persistent, decision-relevant feedback in the context where it matters.", "version": "0.1.0", "implementation": "none", "dependencies": [], "files": [] },
    { "id": "skeleton", "name": "Skeleton", "category": "feedback", "status": "planned", "description": "Reserves the shape of known incoming content when that improves continuity without implying false progress.", "version": "0.1.0", "implementation": "none", "dependencies": [], "files": [] },
    { "id": "dialog", "name": "Dialog", "category": "overlay", "status": "stable", "description": "Keeps a focused decision or task in context when interruption and focus management are justified.", "version": "1.0.0", "implementation": "html-dialog-reference", "dependencies": [], "files": ["components/dialog/README.md", "components/dialog/component.json", "components/dialog/reference/example.html", "components/dialog/reference/component.css", "components/dialog/reference/component.js"] },
    { "id": "field", "name": "Field", "category": "forms", "status": "stable", "description": "Connects a form control with its persistent label, constraints, help and actionable error feedback.", "version": "1.0.0", "implementation": "html-css-js-reference", "dependencies": [], "files": ["components/field/README.md", "components/field/component.json", "components/field/reference/example.html", "components/field/reference/component.css", "components/field/reference/component.js"] },
    { "id": "conversation", "name": "Conversation", "category": "ai", "status": "planned", "description": "Presents user messages, agent replies and task context with clear authorship and continuation.", "version": "0.1.0", "implementation": "none", "dependencies": [], "files": [] },
    { "id": "agent-status", "name": "Agent Status", "category": "ai", "status": "planned", "description": "Communicates the current observable agent state, including waiting, working, paused or completed.", "version": "0.1.0", "implementation": "none", "dependencies": [], "files": [] },
    { "id": "agent-activity", "name": "Agent Activity", "category": "ai", "status": "planned", "description": "Summarizes user-relevant actions performed and events during an agent task.", "version": "0.1.0", "implementation": "none", "dependencies": [], "files": [] },
    { "id": "progress-steps", "name": "Progress Steps", "category": "ai", "status": "planned", "description": "Shows task progress as observable stages and status without exposing private model reasoning.", "version": "0.1.0", "implementation": "none", "dependencies": [], "files": [] },
    { "id": "tool-call", "name": "Tool Call", "category": "ai", "status": "planned", "description": "Explains a relevant tool action, its scope and outcome in terms the user can understand.", "version": "0.1.0", "implementation": "none", "dependencies": [], "files": [] },
    { "id": "task-progress", "name": "Task Progress", "category": "ai", "status": "planned", "description": "Communicates known progress, uncertainty, cancellation and recovery for a longer-running task.", "version": "0.1.0", "implementation": "none", "dependencies": [], "files": [] },
    { "id": "file-diff", "name": "File Diff", "category": "ai", "status": "planned", "description": "Supports review of proposed or completed file changes with clear status and scope.", "version": "0.1.0", "implementation": "none", "dependencies": [], "files": [] },
    { "id": "artifact", "name": "Artifact", "category": "ai", "status": "planned", "description": "Presents a task output with its provenance, available actions and lifecycle.", "version": "0.1.0", "implementation": "none", "dependencies": [], "files": [] },
    { "id": "citation", "name": "Citation", "category": "ai", "status": "planned", "description": "Connects a generated statement to its source and makes source inspection available.", "version": "0.1.0", "implementation": "none", "dependencies": [], "files": [] },
    { "id": "approval", "name": "Approval", "category": "ai", "status": "planned", "description": "Requests an informed user decision before a consequential action proceeds.", "version": "0.1.0", "implementation": "none", "dependencies": [], "files": [] },
    { "id": "permission-request", "name": "Permission Request", "category": "ai", "status": "planned", "description": "Explains requested capability, scope, duration and effects before access is granted.", "version": "0.1.0", "implementation": "none", "dependencies": [], "files": [] },
    { "id": "human-in-the-loop", "name": "Human in the Loop", "category": "ai", "status": "planned", "description": "Makes review, correction, handoff and resumption explicit in an agent-assisted workflow.", "version": "0.1.0", "implementation": "none", "dependencies": [], "files": [] }
  ]
}
